created_at,company,url,text,retweets,likes
2017-05-10 17:00:03,Pfizer,https://twitter.com/pfizer/status/862351541990297602,"#DYK bladder cancer is the 6th most common cancer in the US? RT to raise awareness.
#BladderCancerAwarenessMonth https://t.co/wkYqB1qVla",3,3
2017-05-10 14:00:01,Pfizer,https://twitter.com/pfizer/status/862306232937443330,"This #StrokeMonth, find out how #AFib is related to #stroke risk at #FibsorFacts: https://t.co/7kamYjoErV https://t.co/tzHAUfO1Ji",7,10
2017-05-09 23:12:01,Pfizer,https://twitter.com/pfizer/status/862082761217191936,#Lupus affects 1 in 537 young African American women. Mera Tilley is working to advance genetic #research:… https://t.co/Wt2MvfkqYL,7,19
2017-05-09 20:00:02,Pfizer,https://twitter.com/pfizer/status/862034445355888640,#AFib is responsible for approx. 1/4 of all strokes. We’re joining @StrokeEurope to raise awareness of stroke in AF… https://t.co/5PYUkeKLcb,6,13
2017-05-09 18:01:55,Pfizer,https://twitter.com/pfizer/status/862004723024527360,"Immunizations are not just for babies. On @TheDoctors, our Dr. Freda Lewis-Hall explains &amp; talks teen health tips.… https://t.co/ZpxQ1zMcKx",4,13
2017-05-09 16:36:00,Pfizer,https://twitter.com/pfizer/status/861983100011720704,Pleased about this exciting partnership. https://t.co/iiAnoz1fss,13,27
2017-05-09 13:09:00,Pfizer,https://twitter.com/pfizer/status/861931008496676865,We’re honored to see so many of our colleagues being recognized at this week’s @HBAnet WOTY luncheon. #hbaimpact https://t.co/kfqeVrVut1,0,10
2017-05-09 12:00:02,Pfizer,https://twitter.com/pfizer/status/861913652236099586,"Visit Exhibit Hall A for our #DDW17 product theater, Connecting the Links of Communication, led by Dr. Marla C. Dub… https://t.co/jXqq8jK8pm",5,8
2017-05-09 10:55:28,Pfizer,https://twitter.com/pfizer/status/861897402558681088,Elaine woke to shooting pain in her neck and it spread throughout her body. See Elaine’s story continue in Instagra… https://t.co/cz15hXShZt,2,7
2017-05-08 20:13:01,Pfizer,https://twitter.com/pfizer/status/861675325532635137,Parents tune in! Tmw on @TheDoctors our Dr. Freda Lewis-Hall talks #teen health &amp; reveals 5 reasons why teens shoul… https://t.co/SRSUp2QDi7,6,8
2017-05-08 19:46:02,Pfizer,https://twitter.com/pfizer/status/861668533226393600,Pfizer is providing information to help HCPs treating UC to improve patient care. Learn more about #IBDLink:… https://t.co/0vgjK5oDYn,4,8
2017-05-08 16:00:02,Pfizer,https://twitter.com/pfizer/status/861611660867497984,DYK your #FibsorFacts about #AFib &amp; stroke risk? Test your knowledge this #StrokeMonth: https://t.co/7kamYjoErV https://t.co/f5p1Myq4p8,2,4
2017-05-08 14:16:39,Pfizer,https://twitter.com/pfizer/status/861585642958053376,Proud to collaborate @gatesfoundation @CIFFchild to empower women in developing countries with more contraceptive c… https://t.co/ae42U2qO7M,24,31
2017-05-08 11:00:02,Pfizer,https://twitter.com/pfizer/status/861536163642974208,#DYK that 1 in 5 Americans will develop skin cancer in their lifetime? RT to raise awareness.… https://t.co/hZjoa4NDdU,14,6
2017-05-07 20:13:01,Pfizer,https://twitter.com/pfizer/status/861312937713184774,Suffering from seasonal #allergies this year? Find out how to help control allergy symptoms &amp; avoid triggers.… https://t.co/NzEyNxtXeQ,7,10
2017-05-07 14:42:02,Pfizer,https://twitter.com/pfizer/status/861229641893388288,HCPs attending #DDW17: visit booth #2905 to see how we put patients first &amp; join the conversation by selecting a co… https://t.co/MkLFlgQynT,4,5
2017-05-06 17:46:02,Pfizer,https://twitter.com/pfizer/status/860913560398024705,We’re inspired by the incredible progress that has been made to reduce the global burden of #trachoma.… https://t.co/iSyubLo5N4,9,16
2017-05-06 14:38:01,Pfizer,https://twitter.com/pfizer/status/860866245347946496,We are proud to partner w/ leading gastroenterologists to study conditions such as #ulcerativecolitis. #DDW17 https://t.co/GknVRtziiW,8,18
2017-05-05 23:54:00,Pfizer,https://twitter.com/pfizer/status/860643774917226496,RT @gavi: Wow! Health workers like this guy get vaccines and their cold boxes to the children who need them the most. 👒🎩🎓 off! h/t @UNICEFU…,108,0
2017-05-05 21:22:01,Pfizer,https://twitter.com/pfizer/status/860605527209979907,"#DYK the exact cause of #ulcerativecolitis, a chronic and often debilitating condition, is unknown? https://t.co/j2ZTlrznip",6,8
2017-05-05 18:13:21,Pfizer,https://twitter.com/pfizer/status/860558047030247424,Need help navigating your #healthcare &amp; #prescription coverage? Visit https://t.co/sSjgSaCpIN to learn more. https://t.co/C2YwZH418V,99,259
2017-05-05 17:14:01,Pfizer,https://twitter.com/pfizer/status/860543116960509952,We strive to transform the lives of people living with #PsoriaticArthritis by working to address unmet medical need… https://t.co/y6NThdhU5m,5,10
2017-05-05 15:19:30,Pfizer,https://twitter.com/pfizer/status/860514296404598784,RT @uicc: Excited to see such an overwhelming interest for phase 2 of the #SPARCgrant initiative: 83 applications submitted! https://t.co/y…,4,0
2017-05-05 14:28:00,Pfizer,https://twitter.com/pfizer/status/860501337326440449,Check out our new #PfizerTrials page to search for clinical trials #CTAW2017 https://t.co/A1vcCeEc5G,3,6
2017-05-05 11:00:01,Pfizer,https://twitter.com/pfizer/status/860448993805041664,Proud to support the @B_C_A_N AmpUp! Walk/Run to End Bladder Cancer across the US. Learn how you can get involved at https://t.co/oDVAnwlTmZ,2,4
2017-05-04 20:52:00,Pfizer,https://twitter.com/pfizer/status/860235584559874049,New data from our Phase 3 studies of an investigational UC treatment published today in @NEJM https://t.co/mTzetTIXoV,11,19
2017-05-04 19:43:11,Pfizer,https://twitter.com/pfizer/status/860218266828111872,"#PsA is a complex disease that impacts many parts of the body, including skin &amp; joints. https://t.co/jyaFEccTm8",8,14
2017-05-04 18:00:02,Pfizer,https://twitter.com/pfizer/status/860192307571806208,#DYK #AFib can increase a person’s risk of #stroke? Help us raise awareness &amp; follow @StrokeEurope https://t.co/V1A0kMSjd3,4,8
2017-05-04 14:30:03,Pfizer,https://twitter.com/pfizer/status/860139463938330629,Our global #CV disease education program with partner @ACCinTouch expands to Egypt &amp; Saudi Arabia. https://t.co/tapgLBVj4f,6,8
2017-05-03 17:15:01,Pfizer,https://twitter.com/pfizer/status/859818590534586369,"Watch live 2pm ET: Morten Sogaard, Global Head of Genome Sci &amp; Tech speaks on “Demystifying AI”  #BrainstormHealth 
https://t.co/nDrrthPD2x",5,6
2017-05-03 15:05:06,Pfizer,https://twitter.com/pfizer/status/859785897004367876,Chris Boshoff talks solutions for ensuring clinical trials respond to oncology’s most pressing challenges at… https://t.co/eRMrIZiCXv,5,7
2017-05-03 13:59:01,Pfizer,https://twitter.com/pfizer/status/859769267318906881,Morrie Birnbaum is focused on explaining how metabolic abnormalities can lead to #NASH &amp; #liverdisease #WMIF17… https://t.co/Y8SxE8AXJh,7,8
2017-05-03 13:29:02,Pfizer,https://twitter.com/pfizer/status/859761720021143553,We’re honored to speak on our role in addressing the diseases of poverty @WEF #WEFAfrica2017 https://t.co/2I5riaE2RL,10,23
2017-05-03 13:10:32,Pfizer,https://twitter.com/pfizer/status/859757066193444864,Today the @FDA accepted the supplemental new drug applications for our oral #PsoriaticArthritis treatment https://t.co/is1uxECGMP,5,9
2017-05-03 02:25:55,Pfizer,https://twitter.com/pfizer/status/859594842598518784,Liz Barrett reminds Asembia Specialty Pharmacy conference that partnerships are key to discovery #asembia17 https://t.co/nGiTTo8III,11,23
2017-05-02 21:18:50,Pfizer,https://twitter.com/pfizer/status/859517561003749376,We couldn’t agree more. Glad @Pfizer was part of this important conversation on #AfricaInnovates today – so much to… https://t.co/VgUF83y4dg,5,17
2017-05-02 18:47:02,Pfizer,https://twitter.com/pfizer/status/859479359169626112,"Our Morrie Birnbaum will share the ""Skinny on Fat"" at this year’s #WMIF17. Join him if you’re there! #HeartDisease… https://t.co/nabTiFcrAW",8,16
2017-05-02 00:23:02,Pfizer,https://twitter.com/pfizer/status/859201529185792001,Our Dr. Freda Lewis-Hall comments on cracking the code &amp; burden of chronic disease at @MilkenInstitute #MIGlobal https://t.co/x99fvQ5t6j,11,22
2017-05-01 18:53:02,Pfizer,https://twitter.com/pfizer/status/859118481593315328,Allison Kean will discuss the role of gender in #clinical trials to optimize care at @PartnersWMIF’s #WMIF17… https://t.co/pSgZCaGVDR,10,26
2017-05-01 16:00:11,Pfizer,https://twitter.com/pfizer/status/859074983636631552,We support @StrokeEurope to help raise awareness of stroke through education. Learn more https://t.co/2ZhgG1CmJX… https://t.co/WUgpOcF83F,4,8
2017-04-30 20:43:02,Pfizer,https://twitter.com/pfizer/status/858783778638049282,"In the U.S., tobacco use by those under treatment for mental disorders accounts for nearly 200,000 of the nation's… https://t.co/3EBaGhGf60",10,10
2017-04-30 17:53:01,Pfizer,https://twitter.com/pfizer/status/858740991964131329,Learn about the underdiagnosed condition of #depression in men including common signs &amp; symptoms &amp; seeking help… https://t.co/9R9c87530x,8,12
2017-04-29 22:47:43,Pfizer,https://twitter.com/pfizer/status/858452765680574464,Actor &amp; comedian @WayneBrady opens up to our Dr. Freda Lewis-Hall &amp; shares he doesn’t want his #depression to be a… https://t.co/tDXbONkhRr,8,12
2017-04-29 17:04:08,Pfizer,https://twitter.com/pfizer/status/858366301185740800,Ever wondered why you instinctively scratch an itch? Head to Get Science to learn more: https://t.co/WK1ZWV7NlQ https://t.co/aOCQHhuGo8,3,6
2017-04-28 18:37:03,Pfizer,https://twitter.com/pfizer/status/858027294966906886,Talk to your doctor about how you can help protect yourself &amp; your family this #WorldImmunizationWeek2017. #WIW2017 https://t.co/466Njs2tyM,11,12
2017-04-28 14:45:03,Pfizer,https://twitter.com/pfizer/status/857968911064629248,Been 220+ yrs since the 1st vaccination was discovered in 1796. We've come a long way in transporting vaccines:… https://t.co/3BXD4lbE1H,21,32
2017-04-28 00:22:31,Pfizer,https://twitter.com/pfizer/status/857751846454255618,Proud of our own Freda Lewis-Hall &amp; the other 2017 Top Blacks in Healthcare honorees @blackdoctor #TBH2017DC https://t.co/ESxTDntyUu,15,27
2017-04-27 22:16:02,Pfizer,https://twitter.com/pfizer/status/857720017743486976,"Kirsten Axelsen, Pfizer Essential Health VP Strategy, commented on important healthcare policies at the NAAG Presid… https://t.co/5O550ocE3h",5,12
2017-04-27 20:23:02,Pfizer,https://twitter.com/pfizer/status/857691579309592577,Our Colleague Resource Groups drive diversity &amp; inclusion in our business. Read how in the #PfizerAnnualReview:… https://t.co/cNlux4DxOy,7,8
2017-04-27 19:32:00,Pfizer,https://twitter.com/pfizer/status/857678738078789635,"RT @WHOAfghanistan: #VaccinesWork to fight diseases! #Immunization is the right of every child as it prevents illness, disability &amp; death h…",62,0
2017-04-27 18:32:00,Pfizer,https://twitter.com/pfizer/status/857663638064308224,"RT @WHOSEARO: Life is precious
#Vaccinate your children &amp; protect them from disease. 
Contact your nearest health center to find out more.…",42,0
2017-04-27 17:10:01,Pfizer,https://twitter.com/pfizer/status/857643005767024641,"RT @WHO: In almost every country, some population groups have limited access to vaccines.
#VaccinesWork, Let's make sure NO child is left b…",161,0
2017-04-27 13:35:02,Pfizer,https://twitter.com/pfizer/status/857588903964016640,Learn why childhood vaccinations are so important to your baby’s health this #NIIW: https://t.co/ts7Su0ayI6 https://t.co/Kld3aOkmJV,2,7
2017-04-26 23:28:01,Pfizer,https://twitter.com/pfizer/status/857375746121240576,"This #WorldImmunizationWeek, learn about @TheIRC’s project w/ #PfizerFdn to impact children’s health in Ethiopia… https://t.co/LlrVr3axZr",11,10
2017-04-26 21:33:02,Pfizer,https://twitter.com/pfizer/status/857346806879068161,Because even adults need vaccines to help protect themselves against certain infectious diseases. Talk to your doct… https://t.co/TshAImB90t,21,29
2017-04-26 19:38:01,Pfizer,https://twitter.com/pfizer/status/857317865241944065,"n 1967, @WHO began a smallpox eradication program. By 1980, smallpox was eliminated from the planet. Learn more:… https://t.co/lWTOGNM5lK",7,6
2017-04-26 18:31:07,Pfizer,https://twitter.com/pfizer/status/857301027518906368,We are helping to address the global problem of #AMR with the launch of our ATLAS surveillance program.… https://t.co/Ouo2f2RekU,9,15
2017-04-26 12:38:00,Pfizer,https://twitter.com/pfizer/status/857212164217679872,RT @WHOWPRO: It's World Immunization Week! Vaccination helps protect everyone from deadly diseases. #vaccineswork https://t.co/mLhoHYccYY h…,79,0
2017-04-25 23:15:00,Pfizer,https://twitter.com/pfizer/status/857010082449682432,We are helping to address the global problem of #AMR with the launch of our ATLAS surveillance program. https://t.co/Yo4oSyDARU,7,8
2017-04-25 20:38:01,Pfizer,https://twitter.com/pfizer/status/856970574094094336,RT @WHOAfghanistan: It's World #Immunization Week! #VaccinesWork to save lives - #vaccination can avert more than one third of under-5 deat…,78,0
2017-04-25 18:12:00,Pfizer,https://twitter.com/pfizer/status/856933830082654209,"RT @ShotAtLife: When it comes to making sure children around the world have access to #vaccines -- ""we need commitment"" says @DrRichardBess…",7,0
2017-04-25 16:24:01,Pfizer,https://twitter.com/pfizer/status/856906653924556800,#DYK there are vaccines recommended for every phase of life? Talk to your doctor this #WorldImmunizationWeek to fin… https://t.co/92nZtNgPvN,8,9
2017-04-24 23:10:01,Pfizer,https://twitter.com/pfizer/status/856646440520744960,We stand w/ @COMOmeningitis on this #WorldMeningitisDay. Trust your instincts &amp; learn more: https://t.co/y5jpg4BWLj https://t.co/VsBLttxKd8,6,8
2017-04-24 19:57:02,Pfizer,https://twitter.com/pfizer/status/856597871860297728,It’s #WorldMeningitisDay. Vaccines help reduce the prevalence of meningitis. Are you protected? Learn more @… https://t.co/itoQ65HA4k,21,24
2017-04-24 18:40:01,Pfizer,https://twitter.com/pfizer/status/856578489633447938,On @DrPhil our Dr. Freda Lewis-Hall &amp; @WayneBrady talk why #depression may be overlooked in the Black community &amp; i… https://t.co/uCcWnKjWvE,3,8
2017-04-24 17:32:28,Pfizer,https://twitter.com/pfizer/status/856561493403422722,"#WorldMeningitisDay. Hear from three mothers whose lives were affected by this uncommon, but serious, disease: https://t.co/k0ttdwqzhz",7,16
2017-04-24 14:29:02,Pfizer,https://twitter.com/pfizer/status/856515330314838016,"#DYK In the U.S., #RSV causes over 57K hospitalizations a year among young children? We’re working to change this. https://t.co/t7JPGO1PRm",6,13
2017-04-24 11:00:03,Pfizer,https://twitter.com/pfizer/status/856462738335436802,Did you know #AMR causes 700K deaths annually? Without action this could increase to 10M by 2050… https://t.co/LSF0cKtRoZ,4,6
2017-04-23 23:25:01,Pfizer,https://twitter.com/pfizer/status/856287825297321985,#WorldImmunizationWeek starts tomorrow with #WorldMeningitisDay. Stay informed &amp; follow our social channels for mor… https://t.co/1RG1ggCOGc,25,25
2017-04-23 20:56:55,Pfizer,https://twitter.com/pfizer/status/856250555446030336,RT @COMOmeningitis: Do you know the different symptoms of #meningitis in children &amp; adults? https://t.co/iyIgzWLtAw #24HourMeningitis https…,16,0
2017-04-23 19:40:00,Pfizer,https://twitter.com/pfizer/status/856231200138174466,Antimicrobial resistance is a growing concern. Hear an expert explain how vaccines can help. #WIW2017 https://t.co/C86L217NUt,16,18
2017-04-23 13:01:47,Pfizer,https://twitter.com/pfizer/status/856130986349916160,Proud to be part of global public-private partnership working to end #trachoma.  https://t.co/inf1zotWbl https://t.co/HjAe5VI5L5,7,13
2017-04-22 15:23:01,Pfizer,https://twitter.com/pfizer/status/855804137576988673,Learn how Pfizer is reducing our environmental footprint in the #PfizerAnnualReview: https://t.co/N4oDa9dUW8… https://t.co/EP8ivqpOvv,5,15
2017-04-22 11:00:01,Pfizer,https://twitter.com/pfizer/status/855737953318055936,We’re here at #ECCMID2017. Learn about our commitment to #AMR here: https://t.co/7iNpEMaMCn https://t.co/LvxTzxUV2k,3,14
2017-04-21 21:17:01,Pfizer,https://twitter.com/pfizer/status/855530838536204288,"On #WorldMeningitisDay, learn about the importance of protection against #MenB, as told by three moms. Check back M… https://t.co/lpj7hlcqAQ",3,14
2017-04-21 21:03:55,Pfizer,https://twitter.com/pfizer/status/855527541590949888,Congratulations to our Chief Medical Officer Freda Lewis-Hall MD for @eyeforpharma Lifetime Achievement Award!… https://t.co/D37P4e2Tt1,10,51
2017-04-21 19:00:02,Pfizer,https://twitter.com/pfizer/status/855496365857800194,Our colleagues are wearing red and black to mark AML World Awareness Day. Share a red and black selfie to support!… https://t.co/6Fc294gpVr,3,8
2017-04-21 16:35:22,Pfizer,https://twitter.com/pfizer/status/855459958380531712,"Imagine a world without #science. This #EarthDay, we're proud to stand behind our scientists &amp; the #ScienceMarch. 🔬… https://t.co/1ap4qjuQle",837,1681
2017-04-20 20:13:02,Pfizer,https://twitter.com/pfizer/status/855152348158668800,Let the countdown begin -1 day until AML World Awareness Day! Re-tweet to help us raise awareness #knowAML #fightAML https://t.co/YOWqslm4xv,7,12
2017-04-20 19:40:39,Pfizer,https://twitter.com/pfizer/status/855144199175450625,"Live from #efpPhilly, Andy Schmeltz, SVP, Patient &amp; Health Impact, discusses why patient-centricity is more than th… https://t.co/8HJriQeiM4",4,13
2017-04-20 18:26:00,Pfizer,https://twitter.com/pfizer/status/855125412120338433,"Proud to announce Healthy Communities, our new collaboration w/ @PSIimpact. Learn more here: https://t.co/4bDNJMjSQY",7,12
2017-04-20 17:39:01,Pfizer,https://twitter.com/pfizer/status/855113588410908672,https://t.co/TqHjmMYfwv,5,16
2017-04-20 14:53:07,Pfizer,https://twitter.com/pfizer/status/855071837826535424,#DYK about ¼ of adults in Myanmar &amp; Vietnam have hypertension? Learn how we are partnering w/ @PSIimpact to help… https://t.co/YoS1V0RRMK,2,5
2017-04-20 14:36:01,Pfizer,https://twitter.com/pfizer/status/855067533753425920,Pfizer #RxPathways empowers patients in need by connecting them to assistance programs. Visit #PfizerAnnualReview:… https://t.co/nFTj6GoG4O,4,9
2017-04-19 20:38:28,Pfizer,https://twitter.com/pfizer/status/854796359316246529,"Albert Bourla, Group President of Innovative Health talks to @Wired about the convergence of #tech &amp; #healthcare https://t.co/HzhOwXXgT6",5,19
2017-04-19 14:00:04,Pfizer,https://twitter.com/pfizer/status/854696100942557185,Proud to support global #trachoma elimination efforts w/ partners to achieve a trachoma-free world #NTDSummit17… https://t.co/EQdj6jW8xC,13,22
2017-04-19 13:25:02,Pfizer,https://twitter.com/pfizer/status/854687285614444544,Today is the first day of the #NTD Summit. Learn how we’ve joined the fight to #beatNTDs in the #PfizerAnnualReview… https://t.co/vDL2002G3L,2,8
2017-04-18 20:11:52,Pfizer,https://twitter.com/pfizer/status/854427278574571521,Our Dr. Freda Lewis-Hall reveals what #depression in men may look like &amp; talks to @WayneBrady about his own battle… https://t.co/9YHp2eJJ5p,7,13
2017-04-18 18:00:42,Pfizer,https://twitter.com/pfizer/status/854394271495061504,We reaffirm our pledge to do our part to #BeatNTDs &amp; #endtrachoma. Visit our new outdoor display @ NYC HQ on 42nd St https://t.co/IzHoOTLL5j,17,30
2017-04-18 15:00:04,Pfizer,https://twitter.com/pfizer/status/854348811216576513,10M+ people worldwide have #Parkinsons. We’re tracking symptoms looking for solutions #UniteForParkinsons… https://t.co/96Y3gajCve,11,8
2017-04-18 13:30:03,Pfizer,https://twitter.com/pfizer/status/854326158422310912,Our CEO Ian Read is speaking today at the #NTDSummit17 in Geneva about our commitment to do our part to #endtrachoma https://t.co/zUnKbppH7C,12,30
2017-04-17 21:00:02,Pfizer,https://twitter.com/pfizer/status/854077013212237824,"Whether living with or caring for someone with hemophilia, women are affected too. Share to support #WHD2017 and ed… https://t.co/FCiIZpEcXV",6,9
2017-04-17 19:22:02,Pfizer,https://twitter.com/pfizer/status/854052351690371072,"Don’t miss it! Tmw on @DrPhil, @WayneBrady shares his journey w/ #depression in an exclusive interview w/ our Dr. F… https://t.co/NClo9HlOeh",20,70
2017-04-17 18:00:07,Pfizer,https://twitter.com/pfizer/status/854031737025953797,"We are working with our worldwide network of partners to #endtrachoma. Together, we can #BeatNTDs. Learn more:… https://t.co/u5ru3CW1f6",14,17
2017-04-17 15:15:23,Pfizer,https://twitter.com/pfizer/status/853990279422103552,Join us on #WHD2017 by supporting women affected by #hemophilia &amp; sharing their perspectives https://t.co/bfsYpth1Ev,9,21
2017-04-17 13:00:02,Pfizer,https://twitter.com/pfizer/status/853956218829758464,Today we unveiled a new outdoor display at our NYC HQ to raise awareness about the global effort to #endtrachoma https://t.co/gbaZ8defeU,22,36
2017-04-16 19:00:52,Pfizer,https://twitter.com/pfizer/status/853684635905261568,#Trachoma propels a cycle of poverty.We’re convening w/our partners @ the #NTDSummit17 this week to help #BeatNTDs… https://t.co/9NbCYtuRhG,11,16
2017-04-16 17:53:01,Pfizer,https://twitter.com/pfizer/status/853667560885235712,We’re working to expand contraceptive access for women most in need in dev world countries #PfizerAnnualReview… https://t.co/d2oArFdMsi,5,23
2017-04-16 15:00:07,Pfizer,https://twitter.com/pfizer/status/853624048504500225,We’re excited to participate in the #NTDSummit17 with @CombatNTDs in Geneva this week. More about the Summit here:… https://t.co/oqES8GtWI4,17,18
2017-04-16 01:47:01,Pfizer,https://twitter.com/pfizer/status/853424459142881280,Social pressures may contribute to smoking among young adults in the #LGBT community. #QuitSmoking https://t.co/KDr3h2kAWn,5,7
2017-04-15 22:41:02,Pfizer,https://twitter.com/pfizer/status/853377655734972416,"Our immune system protects us from pathogens, but can turn on itself. Discover more about #autoimmune diseases:… https://t.co/lEnMUZbamE",4,15
2017-04-14 20:26:02,Pfizer,https://twitter.com/pfizer/status/852981290961907712,We're proud of our Pearl River site's donation to People to People food pantry. Read the full story here:… https://t.co/aoMiTOfi9W,2,11
2017-04-14 15:08:01,Pfizer,https://twitter.com/pfizer/status/852901262353936384,"Our scientist, Jude Samulski, was the first to discover how to use a benign virus to deliver #genetherapy:… https://t.co/Hu6bPzUdOr",7,11
2017-04-14 11:34:01,Pfizer,https://twitter.com/pfizer/status/852847406916018176,Proud to join the Illinois healthcare community to celebrate and support the work of @CommHealthChi… https://t.co/rRtiHZQ777,5,15
2017-04-13 23:13:01,Pfizer,https://twitter.com/pfizer/status/852660928571158528,"Kirsten Axelsen, Pfizer Essential Health VP Strategy, spoke on innovation &amp; access today at @GoldmanSachs Drug Pric… https://t.co/sIbkpKnw8b",1,17
2017-04-13 22:11:56,Pfizer,https://twitter.com/pfizer/status/852645556681932800,RT @GoldmanSachs: Freer access to real-world evidence can improve competition in US pharma says Pfizer's Kirsten Axelsen at $GS' Drug Prici…,14,0
2017-04-13 20:15:04,Pfizer,https://twitter.com/pfizer/status/852616143168827392,Signs your child may be stressed &amp; 6 ways you can help here: https://t.co/WLX6eEXdhd #GetHealthyStayHealthy https://t.co/HDiYOIuLAq,3,8
2017-04-13 17:42:23,Pfizer,https://twitter.com/pfizer/status/852577721238638592,"Learn how we are partnering to tackle #NCDs, the leading cause of death globally: #PfizerAnnualReview… https://t.co/P8yJ4XuhXB",2,5
2017-04-12 15:49:11,Pfizer,https://twitter.com/pfizer/status/852186846184472580,Is stress taking a toll on your child? Our Dr. Freda Lewis-Hall reveals potential warning signs for parents on… https://t.co/t9gbGb4O0z,5,10
2017-04-12 14:20:59,Pfizer,https://twitter.com/pfizer/status/852164648619175938,"Only 1 week left to apply for #SPARCgrant! Proposals due Apr 19, get more info: https://t.co/iFgmgjKUfV https://t.co/nnuHywpU1h",2,4
2017-04-11 23:47:01,Pfizer,https://twitter.com/pfizer/status/851944708318404608,"DYK people with #diabetes are prone to poor #oralhealth, such as #gingivitis? Learn more. #GetHealthyStayHealthy… https://t.co/KuGxKCp4uW",3,9
2017-04-11 20:02:01,Pfizer,https://twitter.com/pfizer/status/851888086426497024,Adults aren’t the only ones that feel “stressed out.”   Our Dr. Freda Lewis-Hall shares how stress can affect child… https://t.co/9xODoYgkIw,5,15
2017-04-11 16:59:01,Pfizer,https://twitter.com/pfizer/status/851842032633032705,"Despite the hurdles, our Nathan Ihle is dedicated to finding transformative cancer therapies. #ActualLivingScientist https://t.co/4bV7DOMY18",0,4
2017-04-11 00:15:25,Pfizer,https://twitter.com/pfizer/status/851589467571982336,"Through worldwide collaborations, we are striving to improve #globalhealth. #PfizerAnnualReview… https://t.co/LYFtlUvzTS",11,13
2017-04-10 13:45:52,Pfizer,https://twitter.com/pfizer/status/851431036638683136,#DYK 185M people are at risk of developing #trachoma? But it’s preventable &amp; we’re partnering to eliminate it… https://t.co/4IikFhjJeD,13,21
2017-04-10 12:50:01,Pfizer,https://twitter.com/pfizer/status/851416979642699776,We congratulate Richard Lalonde for winning @ASCPT_ClinPharm 2017 Scientific Award for Innovation in Drug Dev: https://t.co/7MDK2PtnBy,4,8
