created_at,company,url,text,retweets,likes
2017-11-28 18:07:03,Pfizer,https://twitter.com/pfizer/status/935570751507353600,#DYK that most people diagnosed with #StomachCancer are 65 or older? RT to raise awareness. https://t.co/wgPvRxpFZy,2,4
2017-11-28 16:18:12,Pfizer,https://twitter.com/pfizer/status/935543356570193920,"Millions are discharged from hospitals each year, but many end up right back. Our Dr. Freda Lewis-Hall shares what… https://t.co/k3bZjWelSn",5,10
2017-11-28 15:59:08,Pfizer,https://twitter.com/pfizer/status/935538560203198464,"#DYK there are steps you can take to better manage your #T2D? Read more here: 
https://t.co/qCRFfvo4Wg https://t.co/ii5itfKheF",1,4
2017-11-28 03:42:00,Pfizer,https://twitter.com/pfizer/status/935353053066285056,Counterfeit medicine is more of a problem than you realize. Learn how to protect your family from the threat of fak… https://t.co/JP0ox8NR9l,9,10
2017-11-28 01:41:29,Pfizer,https://twitter.com/pfizer/status/935322723022229504,In 2012-2016 Pfizer helped 1.6 million+ people receive their Pfizer Rx for free or at a savings. Learn more:… https://t.co/LdyWWZVHo5,4,13
2017-11-27 21:22:02,Pfizer,https://twitter.com/pfizer/status/935257432795860993,Coming home from the hospital is not easy. Tmw on @TheDoctors our Dr. Freda Lewis-Hall shares a checklist that can… https://t.co/NvBP43e52t,3,8
2017-11-27 00:54:01,Pfizer,https://twitter.com/pfizer/status/934948391104208896,Interested in learning more about #medicine #access with #PfizerRxPathways? Go to https://t.co/y3MD8EZZCV for more… https://t.co/mc2Ime8fce,2,3
2017-11-26 21:57:06,Pfizer,https://twitter.com/pfizer/status/934903868424638465,If you’re living with #T2D it’s important to work w/ your healthcare provider to develop a management plan.… https://t.co/sZkNWJixpm,5,8
2017-11-25 21:06:01,Pfizer,https://twitter.com/pfizer/status/934528625826783232,“I learned to fight back and NOT give up!” Meet Juanita and others like her at https://t.co/IeuaqqiRfn #NSCLC. https://t.co/MxA8Q3IV1Q,3,17
2017-11-25 17:16:00,Pfizer,https://twitter.com/pfizer/status/934470738186244101,"Think you can tell when a medicine is counterfeit?Watch our ""Fake Medicine Quiz Show"" and test your knowledge: https://t.co/QaULVeUlN3",7,9
2017-11-24 21:50:07,Pfizer,https://twitter.com/pfizer/status/934177333107478529,Be aware—ask your healthcare provider for a type 2 #diabetes screening. https://t.co/RBOA8wQOwK #DearDiabetes… https://t.co/pyIaeLlzev,9,14
2017-11-24 19:05:02,Pfizer,https://twitter.com/pfizer/status/934135791957274629,Smoking is the main cause of lung cancer – estimated to be responsible for 85% of all #lungcancer types. Know the r… https://t.co/aZ4HoIoFmJ,24,27
2017-11-23 20:14:01,Pfizer,https://twitter.com/pfizer/status/933790763397378048,Learn how chance encounters with young #cancer patients inspired Keziban Unsal-Kacmaz to change career paths:… https://t.co/hZzdBvdBUd,2,6
2017-11-23 15:21:16,Pfizer,https://twitter.com/pfizer/status/933717088438538240,"#HappyThanksgiving! Wishing everyone a safe, healthy, &amp; happy holiday. 🍂 https://t.co/x0Rc7I9lcb",10,44
2017-11-22 20:31:01,Pfizer,https://twitter.com/pfizer/status/933432653294002178,"This #Thanksgiving, impress your family and friends with the science behind their favorite recipes. Learn more:… https://t.co/LOMPdsKZKb",7,13
2017-11-22 17:47:34,Pfizer,https://twitter.com/pfizer/status/933391517493989376,Miss our discussion w/ @Innovationsinhc at #AtlanticCSR? Learn about the #PfizerFdn’s support for #health innovator… https://t.co/JoBW5h3KLG,2,8
2017-11-22 16:29:02,Pfizer,https://twitter.com/pfizer/status/933371757251252224,Our Dr. Freda Lewis-Hall checking out @sciencemuseum exhibition on Superbugs &amp; #AMR. Watch a tour of the exhibition… https://t.co/k17kwsRJSu,17,13
2017-11-22 15:00:03,Pfizer,https://twitter.com/pfizer/status/933349363845353474,Need inspiration to help deal with #scanxiety? Check out https://t.co/MCtkUjErCU for motivational quotes from… https://t.co/EX7WpWqd9l,5,15
2017-11-21 21:42:02,Pfizer,https://twitter.com/pfizer/status/933088135399043073,#GetScience celebrates 100 stories &amp; a new look — dive into their latest piece on therapeutic cancer vaccines:… https://t.co/lUwYjTlQDY,9,9
2017-11-21 21:22:42,Pfizer,https://twitter.com/pfizer/status/933083273294696448,@zulayvegasv Thanks for your thoughts!,0,0
2017-11-21 20:41:02,Pfizer,https://twitter.com/pfizer/status/933072784128962561,What happens when cell growth signaling goes awry? The answer may help us develop potential #cancer therapies:… https://t.co/UcC9dpnbYI,2,9
2017-11-21 16:54:00,Pfizer,https://twitter.com/pfizer/status/933015652192997383,"RT @NCCNnews: NCCN, in Collaboration with @Pfizer, Awards 9 Grants for Quality Improvement in #BreastCancer Care https://t.co/9SV09nubfd #c…",6,0
2017-11-21 16:14:56,Pfizer,https://twitter.com/pfizer/status/933005820845019136,@smcdonn4499 Thanks for your interest! Check out https://t.co/ctrHy1MSoV for more info!,0,0
2017-11-21 15:31:07,Pfizer,https://twitter.com/pfizer/status/932994792069455872,Tell us—what steps are you taking to better manage your #diabetes &amp; overall health? https://t.co/gfNmgODA2x https://t.co/tz6k60dytH,5,9
2017-11-20 21:25:02,Pfizer,https://twitter.com/pfizer/status/932721469741821952,"Today on International Transgender Day of Remembrance, we remember those lost to violence as we continue to stand w… https://t.co/wKcdiy0S4l",3,6
2017-11-20 21:20:47,Pfizer,https://twitter.com/pfizer/status/932720399795785729,Giving back to our communities can have a larger impact on the world. Here’s what we’ve been doing in Kendall Squar… https://t.co/PGLtkhbwaD,7,12
2017-11-20 19:47:01,Pfizer,https://twitter.com/pfizer/status/932696806181494785,#Drugdiscovery meets Tetris: How a new approach to drug design is helping our scientists discover new medicines:… https://t.co/SmY4csSsiS,3,13
2017-11-20 18:03:30,Pfizer,https://twitter.com/pfizer/status/932670752515674117,How can the private sector advance #globalhealth innovation? Watch our discussion w/ @innovationsinhc at… https://t.co/0Y3W1pyw3d,95,384
2017-11-20 17:03:03,Pfizer,https://twitter.com/pfizer/status/932655541683392512,#StomachCancer is twice as common in men than women. Learn more about it for #StomachCancerAwarenessMonth https://t.co/xvd7Vb67dU,1,11
2017-11-19 20:34:01,Pfizer,https://twitter.com/pfizer/status/932346244403531776,Fake medicines are a global problem requiring global solutions. Learn how to protect yourself and your family:… https://t.co/L1l4QnSV1g,32,47
2017-11-19 15:40:01,Pfizer,https://twitter.com/pfizer/status/932272257254219776,"Wondering if a daily cup of joe could affect your blood pressure? Read more here:
https://t.co/b2OyF9Mxoj from… https://t.co/hTaEta00gu",7,19
2017-11-19 10:34:00,Pfizer,https://twitter.com/pfizer/status/932195246284443648,@MsMacrophage @OntarioLung Thanks for taking the time to share your comments!,0,0
2017-11-18 18:00:01,Pfizer,https://twitter.com/pfizer/status/931945101881987072,We’re looking forward to hearing from Katherine Hunt with @susangkomen on Sunday at 8:30 AM at #ESMOAsia17 on… https://t.co/19eezArW3w,2,9
2017-11-18 17:05:00,Pfizer,https://twitter.com/pfizer/status/931931255167442944,#ESMOAsia17 attendees join us on Sunday at 8:30 AM as we present our latest data from the Asian Paloma 2 &amp; 3 Palbociclib studies,2,5
2017-11-18 16:35:29,Pfizer,https://twitter.com/pfizer/status/931923829697515520,@tendyourquality We love hearing from our followers! Thank you for posting.,0,0
2017-11-18 00:16:20,Pfizer,https://twitter.com/pfizer/status/931677415931334656,Our Dr. Freda Lewis-Hall shares how your family history can factor in when it comes to #stoke &amp; how to help reduce… https://t.co/I1tmPjcqpw,6,17
2017-11-17 21:42:03,Pfizer,https://twitter.com/pfizer/status/931638588625817600,#DYK lung cancer is one of the most common cancers in the world? RT to spread awareness for… https://t.co/IeYE22WjBf,4,12
2017-11-17 18:35:01,Pfizer,https://twitter.com/pfizer/status/931591519726919680,RT @AtlanticLIVE: SPONSORED: @pfizer &amp; @Innovationsinhc discuss how local innovation can improve #globalhealth at #AtlanticCSR https://t.co…,6,0
2017-11-17 16:25:03,Pfizer,https://twitter.com/pfizer/status/931558814817685505,"The cancer burden is high in APAC.  We must do more to enhance access.  Pfizer is at #ESMOAsia17, and we are commit… https://t.co/7uuWKCUs4M",1,11
2017-11-17 15:23:02,Pfizer,https://twitter.com/pfizer/status/931543205258125314,"We remain committed to spreading awareness about AMR, and taking a lead in the fight to tackle it. #WAAW https://t.co/7JL0CfwV62",36,177
2017-11-17 15:15:02,Pfizer,https://twitter.com/pfizer/status/931541192562659328,.@CedarsSinai’s Dr. Figlin on the approval of the first adjuvant treatment for adults at high risk of recurrence of… https://t.co/TwOP1xb0EL,2,7
2017-11-17 14:24:02,Pfizer,https://twitter.com/pfizer/status/931528358449565696,KCA’s Bill Bro on the impact of the FDA approval of our adjuvant treatment for adults at high risk of recurrence of… https://t.co/DOQKYvdp2D,1,4
2017-11-16 19:09:03,Pfizer,https://twitter.com/pfizer/status/931237700358766593,Did you know we launched a database to track antibiotic resistance patterns on 60+ countries? It’s also a free app.… https://t.co/F0yZ2TcVHO,18,34
2017-11-16 15:09:30,Pfizer,https://twitter.com/pfizer/status/931177414402691072,We’re at #AtlanticCSR to talk about #partnerships and the #GlobalGoals! Stop by our booth or learn more here:… https://t.co/toy3dkf2Ka,6,17
2017-11-16 11:59:40,Pfizer,https://twitter.com/pfizer/status/931129642462994433,"Gastric cancer, also known as #stomachcancer, is the 5th most common cancer in the world. Learn the symptoms and RT… https://t.co/DQwK66ZeNk",14,14
2017-11-15 21:45:04,Pfizer,https://twitter.com/pfizer/status/930914571430359041,Learn about the value of vaccines in preventing &amp; combating antimicrobial resistance (AMR) #WAAW… https://t.co/BWotKn4u3f,3,4
2017-11-15 20:10:03,Pfizer,https://twitter.com/pfizer/status/930890661242507265,"Bacteria like S. aureus are becoming increasingly resistant to antibiotics, making infections harder to treat.… https://t.co/kBY2blZK5T",7,12
2017-11-15 18:54:02,Pfizer,https://twitter.com/pfizer/status/930871531546267648,Join us LIVE from #AtlanticCSR tomorrow as we discuss innovative #globalhealth #partnerships w/ @Innovationsinhc !… https://t.co/GhOjQZurai,6,11
2017-11-15 17:23:03,Pfizer,https://twitter.com/pfizer/status/930848634018713601,Learn about the importance of diversity in #clinicaltrials here: https://t.co/q0qew3b5kr https://t.co/v6DoaJnBdk,6,9
2017-11-15 16:00:03,Pfizer,https://twitter.com/pfizer/status/930827748700024832,"#DYK analysis of #RealWorldData has the potential to inform patient care? More here: 
 https://t.co/vyQGOTxhb3… https://t.co/geB4Bl6QA3",1,8
2017-11-15 14:00:02,Pfizer,https://twitter.com/pfizer/status/930797543193300997,Today is the last day to enter the #IfKidsCouldCure contest. Learn more here: https://t.co/HSFAFRa1NF https://t.co/X1u6gKvuaV,2,6
2017-11-14 23:15:47,Pfizer,https://twitter.com/pfizer/status/930575015413800966,Check out @3BLMedia Best Practice article on how we support global health: https://t.co/6LwaBK0A74… https://t.co/J7m1D844Qt,6,8
2017-11-14 20:24:00,Pfizer,https://twitter.com/pfizer/status/930531786274242561,Congrats @AmDiabetesAssn CVMET Fellowship winners! Proud to support research that may help patients w/CVD &amp; diabetes https://t.co/6vwCCK2k1W,1,2
2017-11-14 19:15:03,Pfizer,https://twitter.com/pfizer/status/930514434367336448,Download @theEIU report &amp; discover the global impact of gaps in stroke prevention &amp; risk factor detection:… https://t.co/2bcoTCLKcz,4,6
2017-11-14 16:45:03,Pfizer,https://twitter.com/pfizer/status/930476685606219776,"Antimicrobial resistance, otherwise known as AMR, explained: #WAAW https://t.co/tRFUM3JVAH",69,129
2017-11-14 15:36:09,Pfizer,https://twitter.com/pfizer/status/930459342763167744,"The number of adults with diabetes worldwide is rising. In recognition of World Diabetes Day, learn the facts:… https://t.co/taGq40LS1E",12,15
2017-11-14 15:24:03,Pfizer,https://twitter.com/pfizer/status/930456300026318848,#DYK 25% of people who suffer a stroke have undiagnosed #AFib? Learn about global gaps in stroke prevention… https://t.co/WUsdjV7pQ6,3,7
2017-11-14 00:28:02,Pfizer,https://twitter.com/pfizer/status/930230810611015686,"While 80% strokes can be avoided, they are still a global burden. Learn more from @theEIU’s report… https://t.co/BTNWcqiePK",2,9
2017-11-13 22:30:00,Pfizer,https://twitter.com/pfizer/status/930201106701045761,RT @AMRAlliance: What simple steps can you take to put a stop to #AntibioticResistance? #AMRAlliance #SuperBugs https://t.co/XvIGWE2eZn,26,0
2017-11-13 21:32:01,Pfizer,https://twitter.com/pfizer/status/930186512607731712,"RT @LungAssociation: Pneumococcal #pneumonia is a serious, potentially life-threatening lung infection.  #WorldPneumoniaDay https://t.co/Ds…",4,0
2017-11-13 19:31:48,Pfizer,https://twitter.com/pfizer/status/930156260544188417,@Rachael_Ruffin Thank you!,0,1
2017-11-13 18:00:05,Pfizer,https://twitter.com/pfizer/status/930133179725434880,#DYK symptoms of #lungcancer usually do not appear until the disease is at an advanced stage? Learn more &amp; RT for… https://t.co/5d05H2pwtF,8,13
2017-11-13 17:44:02,Pfizer,https://twitter.com/pfizer/status/930129140702998534,This is the last week to enter the #IfKidsCouldCure contest with @Scholastic. Learn more here:… https://t.co/52jp4u0G1I,1,7
2017-11-13 16:07:36,Pfizer,https://twitter.com/pfizer/status/930104871063293952,"We are committed to protecting the public health from infectious disease, both now &amp; in the future.  #WAAW https://t.co/t6UwvwdmfR",27,38
2017-11-12 21:57:49,Pfizer,https://twitter.com/pfizer/status/929830618334203904,Coughing &amp; sneezing? Is it a cold or just allergies? Our Dr. Freda Lewis-Hall reveals some clues on how to tell the… https://t.co/ZFxkmvwyZI,6,10
2017-11-12 16:35:07,Pfizer,https://twitter.com/pfizer/status/929749408685715456,"Today we’re excited to join other organizations in the fight against pneumococcal pneumonia, a sometimes-deadly ill… https://t.co/qviaDxUeAY",16,29
2017-11-11 18:02:01,Pfizer,https://twitter.com/pfizer/status/929408890206408704,"To our military, thank you for keeping us safe. Help protect your health #quitsmoking https://t.co/0rz1C1rGIk",4,16
2017-11-11 15:24:01,Pfizer,https://twitter.com/pfizer/status/929369126367322112,Our #ulcerativecolitis symposium at #AIBD2017 is today at noon in Walt Disney World Dolphin Hotel N Hemisphere C-D;… https://t.co/3wh7RwtndL,2,7
2017-11-11 15:07:06,Pfizer,https://twitter.com/pfizer/status/929364871862505472,We partnered w/ @the_USO &amp; hosted our annual volunteer event across 8 US cities to build bikes for military familie… https://t.co/kZoyx9n6pw,15,36
2017-11-10 19:41:25,Pfizer,https://twitter.com/pfizer/status/929071517442412545,"In London? We’re sponsoring an exhibition on Superbugs @ScienceMuseum -it's free, so be sure to check it out. #WAAW https://t.co/PQyDZbnA1X",7,7
2017-11-10 17:32:27,Pfizer,https://twitter.com/pfizer/status/929039062442364928,Today is #NetCancerDay. Show your support and learn more here: https://t.co/89Ka3FQkVA,3,12
2017-11-10 16:30:28,Pfizer,https://twitter.com/pfizer/status/929023460763951104,"At #APEC2017, Pierre Gaudreault is speaking about Pfizer’s work and goals across APEC Economies https://t.co/iSI72cvCc9",5,13
2017-11-10 13:30:02,Pfizer,https://twitter.com/pfizer/status/928978055179177987,"We are excited to welcome back @DrAmritRay as Global President, Pfizer Essential Health R&amp;D! He will support our br… https://t.co/zrvwRn0Fy5",19,67
2017-11-09 20:15:02,Pfizer,https://twitter.com/pfizer/status/928717589106364417,"At @APEC_CEOsummit, we’re surrounded by inspiring people sharing their innovative solutions for APEC economies… https://t.co/pVn9Diyv1W",2,9
2017-11-09 16:00:05,Pfizer,https://twitter.com/pfizer/status/928653429110689792,Pfizer’s Patrick van der Loo is at #APEC2017 discussing NCDs in the Asia Pacific region. https://t.co/9qK4RpsjQP,3,8
2017-11-09 15:30:02,Pfizer,https://twitter.com/pfizer/status/928645864599572480,We’re presenting an abstract in #ulcerativecolitis at #AIBD2017. Excited to join the #IBD community in Orlando @IBDConference,3,6
2017-11-09 14:44:13,Pfizer,https://twitter.com/pfizer/status/928634337666502663,#PfizerFdn is proud to work w/ @innovationsinhc to help #health innovators like @LNInternational expand their impac… https://t.co/E1xNj1cvPe,5,10
2017-11-08 21:38:00,Pfizer,https://twitter.com/pfizer/status/928376081337475072,"That’s a wrap, @ACRheum! What did you find most interesting at #ACR17?",1,4
2017-11-08 20:30:03,Pfizer,https://twitter.com/pfizer/status/928358981197803520,Pierre Gaudreault discusses the rise of NCDs within APEC countries &amp; the ways @Pfizer is creating innovative treatm… https://t.co/x3oPGfsySi,4,6
2017-11-08 18:29:07,Pfizer,https://twitter.com/pfizer/status/928328545906065409,"On this year’s #WorldPneumoniaDay, learn about preventative measures you can take to help protect against pneumococ… https://t.co/Ag9gX2FRbV",14,11
2017-11-08 16:43:03,Pfizer,https://twitter.com/pfizer/status/928301852852129798,#PfizerFdn support has helped #globalhealth entrepreneurs serve 141K+ new patients. Learn more from… https://t.co/Jji5d7Ya30,11,13
2017-11-08 16:20:38,Pfizer,https://twitter.com/pfizer/status/928296211827843073,RT @innovationsinhc: $100K to 15 #global #health #innovators 2 magnify #globalhealth #impact-What did we learn? @pfizer @innovationsinhc ht…,4,0
2017-11-08 00:30:41,Pfizer,https://twitter.com/pfizer/status/928057149346938880,Interested in learning more about #medicine #access with #PfizerRxPathways? Check out our how-to video: https://t.co/pvbiYwQleX,15,14
2017-11-07 23:20:53,Pfizer,https://twitter.com/pfizer/status/928039582301589504,"Learn about the amazing building blocks that make you, you: GENES https://t.co/jsVqhGYuLo",2,9
2017-11-07 19:22:02,Pfizer,https://twitter.com/pfizer/status/927979475836571655,It's been almost 1 year since we expanded our humanitarian assistance program. Learn about the progress made here:… https://t.co/yvKB7eNEbp,63,160
2017-11-07 17:07:11,Pfizer,https://twitter.com/pfizer/status/927945540079415296,Our Dr. Freda Lewis-Hall shares what to expect &amp; how to prepare before going under #anesthesia. Watch here on… https://t.co/kjB1qTKywQ,4,7
2017-11-06 22:50:01,Pfizer,https://twitter.com/pfizer/status/927669428879323137,"#DYK that #PsoriaticArthritis is a chronic, lifelong condition that affects as many as 2.4 million Americans? #ACR17 https://t.co/UlWYpsy5ps",4,7
2017-11-06 21:01:01,Pfizer,https://twitter.com/pfizer/status/927641998823215104,Ever wondered how #anesthesia works? Tune in! Tmw on @TheDoctors our Dr. Freda Lewis-Hall explains https://t.co/wd9FAzkpEU,2,8
2017-11-06 17:23:03,Pfizer,https://twitter.com/pfizer/status/927587142238339073,"Inspired by one of our scientists, our contest asks kids to tell us what problems they dream of solving. Learn more… https://t.co/C6NwP0xJ2c",7,10
2017-11-05 23:08:02,Pfizer,https://twitter.com/pfizer/status/927311572858482688,You can help lower that statistic by quitting smoking! #QuitSmoking https://t.co/3z0DLW0naB,20,15
2017-11-05 21:45:00,Pfizer,https://twitter.com/pfizer/status/927290676903075840,More to come at #ACR17! Learn about how we’ve been helping to advance #RheumatoidArthritis research for 60+ years: https://t.co/APHk5GI8OF,6,11
2017-11-05 17:22:00,Pfizer,https://twitter.com/pfizer/status/927224491410903041,Head to Memorial Hall in Philly &amp; stop by the new Lung Cancer Profiles photo booth. Get your picture taken &amp; make a pledge #LCAM,1,9
2017-11-04 23:48:01,Pfizer,https://twitter.com/pfizer/status/926959248998850560,There‘s more than 200 different types of #cancer. Learn more about PFE’s approach to #oncology R&amp;D… https://t.co/yy0Lf3jyLv,22,30
2017-11-04 18:30:32,Pfizer,https://twitter.com/pfizer/status/926879350577876992,Excited to be in San Diego for #ACR17 this week. Follow along for updates on our latest research in #rheumatology https://t.co/BddnPVpLln,9,21
2017-11-04 17:37:02,Pfizer,https://twitter.com/pfizer/status/926865887348645888,Does eating #peanuts as an infant lower the risk of an #allergy later? Learn whether that’s #fact or #fiction here:… https://t.co/eTNfDAyBXM,9,12
2017-11-03 17:28:04,Pfizer,https://twitter.com/pfizer/status/926501242096050176,"Watch Elfriede, a woman living with #metastaticBC in Brazil, describe how her outlook on life has changed since her… https://t.co/BE3H5IzBt4",5,4
2017-11-03 14:47:21,Pfizer,https://twitter.com/pfizer/status/926460795055235073,Patti LaBelle (@MsPattiPatti) has a new attitude on getting &amp; staying healthy. She shares her story w/ our Dr. Fred… https://t.co/3yIHFXg2lo,6,16
2017-11-02 21:27:01,Pfizer,https://twitter.com/pfizer/status/926198988050747392,RT @devex: What did we learn from Ebola? @pfizer #Health4Security https://t.co/BcRXXVu2vJ,9,0
2017-11-02 20:27:02,Pfizer,https://twitter.com/pfizer/status/926183894092836865,"Don’t miss it! Tmw on @TheDoctors, Patti LaBelle (@MsPattiPatti) sits down w/ our Dr. Freda Lewis-Hall and reveals… https://t.co/86nubHZhOA",1,9
2017-11-02 18:28:54,Pfizer,https://twitter.com/pfizer/status/926154162819170305,Our innovative partnerships help drive change in a complex healthcare environment. Learn how… https://t.co/I1y3GJjPEW,9,21
2017-11-02 16:06:47,Pfizer,https://twitter.com/pfizer/status/926118398756638720,Learn about the LIVER: https://t.co/rRrGDtRgT8,3,8
2017-11-02 14:55:03,Pfizer,https://twitter.com/pfizer/status/926100348313440257,Our data shared at #ABClisbon sheds light on an important area for #metastaticBC patients: quality of life https://t.co/qdmAXlnc0L,5,12
2017-11-02 13:00:05,Pfizer,https://twitter.com/pfizer/status/926071413945065472,Our #SPARCgrant awardees held a workshop with @UICC yesterday at #ABClisbon to share best practices in… https://t.co/OhLQKrtDWX,2,9
2017-11-01 20:26:00,Pfizer,https://twitter.com/pfizer/status/925821246524329984,5 days until the @breathedeepdc Washington DC 5K! Check out our brand new Lung Cancer Profiles photo booth!,1,4
2017-11-01 16:20:00,Pfizer,https://twitter.com/pfizer/status/925759336512663553,"RT @PfizerCongress: To learn more about why we’re working together to advance science and patients’ care, come visit booth 42 at #UEGWeek h…",4,0
2017-11-01 12:52:01,Pfizer,https://twitter.com/pfizer/status/925706996560646151,RT @PfizerCongress: Good morning #UEGWeek! Have you ever put yourself in the shoes of a UC patient? https://t.co/BlmXCXuDuL,2,0
2017-11-01 11:00:02,Pfizer,https://twitter.com/pfizer/status/925678816395186178,It’s been a great #UEGWeek. Looking forward to Vienna for UEG Week 2018. https://t.co/ilcvG0riAR,1,13
2017-10-31 20:17:02,Pfizer,https://twitter.com/pfizer/status/925456599484915712,"Pfizer is sharing patient stories, resources &amp; tips during the 100 Days of Inspiration. Learn more:… https://t.co/1rKvLNJyml",5,12
2017-10-31 19:40:01,Pfizer,https://twitter.com/pfizer/status/925447287542829063,So proud of our colleagues who participated in our virtual walk for #eczemamonth and in support of @nationaleczema… https://t.co/qTBdnBP2Jn,4,12
2017-10-31 17:52:02,Pfizer,https://twitter.com/pfizer/status/925420108746502146,"As Eczema Awareness Month comes to a close, we are proud to support the eczema community this month #eczemamatters… https://t.co/mBaWI9Nyw2",5,6
2017-10-31 17:32:48,Pfizer,https://twitter.com/pfizer/status/925415271933906944,"If kids could invent a solution for anything, what problem would they most want to solve? https://t.co/ENccfz43eV",2,4
2017-10-31 16:00:03,Pfizer,https://twitter.com/pfizer/status/925391930313379840,"After 10 years of in-market experience in Europe, we are still committed to finding new treatment options for patie… https://t.co/JYnKgnslq5",2,4
2017-10-31 11:00:02,Pfizer,https://twitter.com/pfizer/status/925316427321692160,"#Biosimilars can expand treatment options for patients, physicians &amp; payers. Learn more here:… https://t.co/4UlccLLpBs",4,10
2017-10-30 20:20:02,Pfizer,https://twitter.com/pfizer/status/925094967013511170,"For information on our commitment to exploring #biosimilars to expand treatment options in #IBD visit booth 42, Hal… https://t.co/EEyossmh8w",1,15
2017-10-30 18:28:03,Pfizer,https://twitter.com/pfizer/status/925066785501609984,We are committed to exploring #biosimilars for patients in #IBD. Learn more this #UEGWeek here:… https://t.co/TX1CFW8FSe,7,22
2017-10-30 16:28:34,Pfizer,https://twitter.com/pfizer/status/925036716272095237,It’s the 25th anniversary of #UEGWeek. Looking forward to an interesting and informative meeting in Barcelona this… https://t.co/pqDqPEC2jM,1,6
2017-10-30 15:55:02,Pfizer,https://twitter.com/pfizer/status/925028277647036416,We’re asking the next generation of scientists to tell us what problems they dream of solving. Learn more:… https://t.co/3gPXcl9UaQ,3,7
2017-10-30 11:00:00,Pfizer,https://twitter.com/pfizer/status/924954032606711808,Interim results from our Phase 3 LTE study of an investigational #ulcerativecolitis treatment are being presented today at #UEGWeek @my_ueg,3,10
2017-10-29 19:16:01,Pfizer,https://twitter.com/pfizer/status/924716471095386115,A team of Pfizer scientists uses high-tech tools to find #counterfeit medicines. Learn more on Get Science:… https://t.co/GfA0M699ZG,18,30
2017-10-29 17:39:05,Pfizer,https://twitter.com/pfizer/status/924692074938732544,@JohnMRinaldi We love hearing from our followers! Thank you for posting.,0,0
